{
  "schemaVersion": 1,
  "sourceId": "0154MJJA9954MJJA9954MJJA99",
  "organizationId": "01ARZ3NDEKTSV4RRFFQ69G5FAV",
  "sourceSha256": "e25463f4b4eb8b895f1bbb5e153a1806c4196158ee4dc2761147c6fb3190e5cd",
  "language": "en-US",
  "markdownArtifactId": "0145AHCB0MQBXYASXX9NDE7XA2",
  "assetArtifactIds": [],
  "conversionProfileArtifactId": "012DS0WZ2E7ZV9JYRG4VBW0VPG",
  "parserVersion": "source-parser@1+ppt-master-v4.7.0",
  "createdAt": "2026-08-16T00:00:00Z"
}
