{
  "schemaVersion": 1,
  "sourceId": "014CHJ68S34CHJ68S34CHJ68S3",
  "organizationId": "01ARZ3NDEKTSV4RRFFQ69G5FAV",
  "sourceSha256": "693feed7f92e7a0ecf4f8a13fbb43bf595400394d7dbbf1219d9f420e2a68757",
  "language": "zh-CN",
  "markdownArtifactId": "01S5GSY9NSR306YSW1HQAANSW2",
  "assetArtifactIds": [],
  "conversionProfileArtifactId": "01QMJCR0ZYR0ZQVMB028PHP8RN",
  "parserVersion": "source-parser@1+ppt-master-v4.7.0",
  "createdAt": "2026-08-16T00:00:00Z"
}
