{
  "schemaVersion": 1,
  "sourceId": "0150M2GA1850M2GA1850M2GA18",
  "organizationId": "01ARZ3NDEKTSV4RRFFQ69G5FAV",
  "sourceSha256": "0286cf055a8832967bb02baba42e135863ebd6e85c0d47c93057b8beae9f3dd2",
  "language": "zh-CN",
  "markdownArtifactId": "01DCMEW6Z6YAN93VSETKHP7WFE",
  "assetArtifactIds": [],
  "conversionProfileArtifactId": "015NJM48JQ9DQ7XXJD98YAWG3C",
  "parserVersion": "source-parser@1+ppt-master-v4.7.0",
  "createdAt": "2026-08-16T00:00:00Z"
}
