{
  "schemaVersion": 1,
  "sourceId": "014RK2C9H64RK2C9H64RK2C9H6",
  "organizationId": "01ARZ3NDEKTSV4RRFFQ69G5FAV",
  "sourceSha256": "e570cc5ffe075b36938921a1ab3bad199af43a273c99199bc6c0538040d28bb9",
  "language": "mixed",
  "markdownArtifactId": "01WNRCRQZY0XDKD4W946GTPEXD",
  "assetArtifactIds": [],
  "conversionProfileArtifactId": "01YAHQM5J6BQVG4NGF7YJA8BA7",
  "parserVersion": "source-parser@1+ppt-master-v4.7.0",
  "createdAt": "2026-08-16T00:00:00Z"
}
