{
  "schemaVersion": 1,
  "sourceId": "0144GJ289144GJ289144GJ2891",
  "organizationId": "01ARZ3NDEKTSV4RRFFQ69G5FAV",
  "sourceSha256": "552583d9bbfaa3ce4e787bfd0bd0537f8fb14bf292788deca1a6f7c275c9a8d7",
  "language": "zh-CN",
  "markdownArtifactId": "01AMJR7PDVZAHWWKKRFFYGQM2K",
  "assetArtifactIds": [],
  "conversionProfileArtifactId": "0182PDP0F5FRYRS5N5M3CWJN50",
  "parserVersion": "source-parser@1+ppt-master-v4.7.0",
  "createdAt": "2026-08-16T00:00:00Z"
}
