{
  "schemaVersion": 1,
  "sourceId": "0158N2MAHA58N2MAHA58N2MAHA",
  "organizationId": "01ARZ3NDEKTSV4RRFFQ69G5FAV",
  "sourceSha256": "5786ff9c44bf1df5a338828a4fc34a71e7a90eb76f114fb263659189ad594da6",
  "language": "mixed",
  "markdownArtifactId": "0137FREN6GCCSK5PJA9A6AZ5ND",
  "assetArtifactIds": [],
  "conversionProfileArtifactId": "01XVXM1YXT6HVRRBJYV8Z6S63K",
  "parserVersion": "source-parser@1+ppt-master-v4.7.0",
  "createdAt": "2026-08-16T00:00:00Z"
}
