{
  "schemaVersion": 1,
  "sourceId": "014WKJE9S74WKJE9S74WKJE9S7",
  "organizationId": "01ARZ3NDEKTSV4RRFFQ69G5FAV",
  "sourceSha256": "29fb2bb0bff46ff1cfa13c946560588c2125c7d8d35e54075e560eb6e195a4bd",
  "language": "en-US",
  "markdownArtifactId": "010WFF463VW43E4FK84BJKRVEQ",
  "assetArtifactIds": [],
  "conversionProfileArtifactId": "01P1QSNSMJP171AQZVRF1WY470",
  "parserVersion": "source-parser@1+ppt-master-v4.7.0",
  "createdAt": "2026-08-16T00:00:00Z"
}
