{
  "schemaVersion": 1,
  "sourceId": "0148H248H248H248H248H248H2",
  "organizationId": "01ARZ3NDEKTSV4RRFFQ69G5FAV",
  "sourceSha256": "05cb988be9561935434d9758e1309f524c9490a7f84b1435c7c4ae16abf0b5b5",
  "language": "en-US",
  "markdownArtifactId": "010Q5SH2Z9ARCKAGTDJXCE2C4Z",
  "assetArtifactIds": [],
  "conversionProfileArtifactId": "013H7RT0Y0MXX8JSDFGAMT1TH0",
  "parserVersion": "source-parser@1+ppt-master-v4.7.0",
  "createdAt": "2026-08-16T00:00:00Z"
}
