{
  "schemaVersion": 1,
  "sourceId": "01ARZ3NDEKTSV4RRFFQ69G5FAY",
  "organizationId": "01ARZ3NDEKTSV4RRFFQ69G5FAV",
  "sourceSha256": "cccccccccccccccccccccccccccccccccccccccccccccccccccccccccccccccc",
  "language": "zh-CN",
  "markdownArtifactId": "01ARZ3NDEKTSV4RRFFQ69G5FAZ",
  "assetArtifactIds": [],
  "conversionProfileArtifactId": "01ARZ3NDEKTSV4RRFFQ69G5FB7",
  "parserVersion": "source-parser@1",
  "createdAt": "2026-08-16T08:00:00Z"
}
