{
  "schemaVersion": 1,
  "sourceId": "014GJ289144GJ289144GJ28914",
  "organizationId": "01ARZ3NDEKTSV4RRFFQ69G5FAV",
  "sourceSha256": "120b0042d6521e249935cb9915131e854511a45cd9381450dd44dfe4621ad983",
  "language": "zh-CN",
  "markdownArtifactId": "01YH8VP3PCWRAHX7DD43KZ05JZ",
  "assetArtifactIds": [],
  "conversionProfileArtifactId": "01VYNTJC0N903SVRMS0F8A1ZAH",
  "parserVersion": "source-parser@1+ppt-master-v4.7.0",
  "createdAt": "2026-08-16T00:00:00Z"
}
