{
  "schemaVersion": 1,
  "sourceId": "014MJJA9954MJJA9954MJJA995",
  "organizationId": "01ARZ3NDEKTSV4RRFFQ69G5FAV",
  "sourceSha256": "cc9f57d21ed179678435a5ffdcb7c09f9328cd9b77ae0ac08be8742296028d38",
  "language": "mixed",
  "markdownArtifactId": "01N68FNYR443PSJDEJBZPD3SDD",
  "assetArtifactIds": [],
  "conversionProfileArtifactId": "01VJAAVD58MMF1YPFTDSTS40RT",
  "parserVersion": "source-parser@1+ppt-master-v4.7.0",
  "createdAt": "2026-08-16T00:00:00Z"
}
